{
  "$schema": "https://json-schema.org/draft/2020-12/schema",
  "$id": "fink_grb/instruments/instrument_schema_version_1.0.json",
  "title": "Instrument",
  "description": "The description of an astronomical observatory sending alerts on the General Coordinates network",
  "type": "object",
  "properties": {
    "name": {
      "description": "name of the instrument",
      "type": "string"
    },
    "//gcn_description": {
      "description": "URL where to find the GCN description for this instrument",
      "type": "string"
    },
    "gcn_file_format": {
      "description": "gcn file format get from the gcn kafka stream",
      "type": "string"
    },
    "packet_type": {
      "description": "packet type to listen by the GCN stream service",
      "type": "array",
      "items": {
        "oneOf": [
          {
            "type": "integer"
          },
          {
            "type": "string"
          }
        ]
      },
      "minItems": 1,
      "uniqueItems": true
    },
    "kafka_topics": {
      "description": "the kafka topics to listen for this instrument",
      "type": "array",
      "items": {
        "type": "string"
      },
      "minItems": 1,
      "uniqueItems": true
    },
    "grb_detection_rate": {
      "description": "number of gamma ray burst detection per year for the given observatory (if a gamma ray bust observatory)",
      "type": "integer"
    }
  },
  "required": [
    "name",
    "packet_type",
    "kafka_topics"
  ]
}