{
    "name": "SWIFT",
    "//gcn_description": "https://gcn.gsfc.nasa.gov/swift.html",
    "gcn_file_format": "xml",
    "packet_type": [
        61,
        63,
        65,
        67,
        81,
        84,
        97
    ],
    "kafka_topics": [
        "gcn.classic.voevent.SWIFT_ACTUAL_POINTDIR",
        "gcn.classic.voevent.SWIFT_BAT_ALARM_LONG",
        "gcn.classic.voevent.SWIFT_BAT_ALARM_SHORT",
        "gcn.classic.voevent.SWIFT_BAT_GRB_ALERT",
        "gcn.classic.voevent.SWIFT_BAT_GRB_LC",
        "gcn.classic.voevent.SWIFT_BAT_GRB_LC_PROC",
        "gcn.classic.voevent.SWIFT_BAT_GRB_POS_ACK",
        "gcn.classic.voevent.SWIFT_BAT_GRB_POS_NACK",
        "gcn.classic.voevent.SWIFT_BAT_GRB_POS_TEST",
        "gcn.classic.voevent.SWIFT_BAT_KNOWN_SRC",
        "gcn.classic.voevent.SWIFT_BAT_MONITOR",
        "gcn.classic.voevent.SWIFT_BAT_QL_POS",
        "gcn.classic.voevent.SWIFT_BAT_SCALEDMAP",
        "gcn.classic.voevent.SWIFT_BAT_SLEW_POS",
        "gcn.classic.voevent.SWIFT_BAT_SUB_THRESHOLD",
        "gcn.classic.voevent.SWIFT_BAT_SUBSUB",
        "gcn.classic.voevent.SWIFT_BAT_TRANS",
        "gcn.classic.voevent.SWIFT_FOM_OBS",
        "gcn.classic.voevent.SWIFT_FOM_PPT_ARG_ERR",
        "gcn.classic.voevent.SWIFT_FOM_SAFE_POINT",
        "gcn.classic.voevent.SWIFT_FOM_SLEW_ABORT",
        "gcn.classic.voevent.SWIFT_POINTDIR",
        "gcn.classic.voevent.SWIFT_SC_SLEW",
        "gcn.classic.voevent.SWIFT_TOO_FOM",
        "gcn.classic.voevent.SWIFT_TOO_SC_SLEW",
        "gcn.classic.voevent.SWIFT_UVOT_DBURST",
        "gcn.classic.voevent.SWIFT_UVOT_DBURST_PROC",
        "gcn.classic.voevent.SWIFT_UVOT_EMERGENCY",
        "gcn.classic.voevent.SWIFT_UVOT_FCHART",
        "gcn.classic.voevent.SWIFT_UVOT_FCHART_PROC",
        "gcn.classic.voevent.SWIFT_UVOT_POS",
        "gcn.classic.voevent.SWIFT_UVOT_POS_NACK",
        "gcn.classic.voevent.SWIFT_XRT_CENTROID",
        "gcn.classic.voevent.SWIFT_XRT_EMERGENCY",
        "gcn.classic.voevent.SWIFT_XRT_IMAGE",
        "gcn.classic.voevent.SWIFT_XRT_IMAGE_PROC",
        "gcn.classic.voevent.SWIFT_XRT_LC",
        "gcn.classic.voevent.SWIFT_XRT_POSITION",
        "gcn.classic.voevent.SWIFT_XRT_SPECTRUM",
        "gcn.classic.voevent.SWIFT_XRT_SPECTRUM_PROC",
        "gcn.classic.voevent.SWIFT_XRT_SPER",
        "gcn.classic.voevent.SWIFT_XRT_SPER_PROC",
        "gcn.classic.voevent.SWIFT_XRT_THRESHPIX",
        "gcn.classic.voevent.SWIFT_XRT_THRESHPIX_PROC"
    ],
    "grb_detection_rate": 100
}